序号,诉求,诉求时间,回复时间
28,胶州市国土局挂牌出让李哥庄魏家屯村土地50亩，该村全体党员村民均不知道，请问是如何办理的手续，多少钱一亩的出让价格，为什么不能做到公务透明，连年来，该村土地被变卖殆尽，全体村民吃什么？后路怎么办？希望给出答复，此事全体党员村民密切关注，希望不要引起群体性上访事件。最好有政府工作人员来开会吧此事解释明白。,2020-04-03,2020-04-03
29,蓼兰镇许家村是否合村并居？什么时候开始？,2020-03-30,2020-04-03
30,胶州九龙街道东石河有没有拆迁计划？,2020-04-02,2020-04-03
序号,诉求,诉求时间,回复时间
31,想问下 清明期间想回趟德州岳父家（过年到现在一直没出过胶州）回来需要隔离吗？,2020-04-02,2020-04-03
32,2017年底，村里通知洙河要清理河道，沿岸的树木要砍伐清理，是否有补偿金？,2020-03-31,2020-04-03
33,我是甘水湾社区居民，军人家属，农村户口，在甘水湾有合法房屋4间。2017年11月10日甘水湾社区书记薛洪果在我不知情的情况下将我的房屋拆除，将安置房房和补偿款私自处置给了唐永前。我和唐永前虽然是姐弟关系，但建房时我们各自成家，他跟我的房屋没有任何关系。甘水湾社区书记薛洪果为了谋取私利，将属于我的安置利益私自处置给唐永前。长达两年半的时间，所有证据一目了然，我的房屋没有纠纷。我多次到薛家岛办事处要求返还安置房，社区书记薛洪果以家庭纠纷为由拒绝返还我安置房。我拿着证据反映问题，而社区书记编造谎言敷衍上级，薛家岛办事处领导官官相护推诿扯皮掩盖社区书记的违法犯罪行为。我这是第5次写信，希望市长不要让您的子民绝望，希望在您的带领下百姓安居乐业，再无村官恶霸！,2020-03-29,2020-04-03
34,举报人刘天基提供本人照片和身份证各一份。举报人刘天基举报平度市开发区大泥河头村西北角违法建设市场大棚崔广东和邓伟玉等人的违法行为证据确凿，铁证如山，无须诉讼，通过举报信访等是反映崔广东和邓伟玉等人违法违规违纪腐败行为的一种合法渠道。请领导严查山东省政务热线12345的回复违法建设市场大棚公开帮崔广东和邓伟玉等人弄虚作假，玩弄法律，颠倒是非黑白，承当保护伞。请严查山东省平度市开发区大泥河头村的西北角违法建设的市场大棚举报约在3万多次没有拆除，有二十多份证据证明属于严重违法建设的市场大棚，举报三年之久至今为止没有拆除。刘天基自2017年6月份开始通过各种渠道举报违法建设市场大棚大约在3万多次，有山东省，青岛市，平度市国土局平度市城乡规划局等各部门的政府信息公开，法院判决等有二十多份证据包括行政处罚等证据都认可属于严重的违法建设市场大棚。举报人刘天基申请平度市国土局依法查处破坏基本农田建设市场大棚，平度市国土局局长邓伟玉不但不履行法定职责，依法查处违法建设市场大棚反而还弄虚作假，制造假的文件，违法批地，破坏基本农田，为他人谋取私利，邓伟玉玩忽职守属于严重的执法犯法，无法无天，顶风而上，弄虚作假，欺上瞒下，不作为，乱作为，搞形式主义，官僚主义特别严重。举报人刘天基申请平度市综合行政执法局依法拆除违法建设市场大棚，平度市综合行政执法局局长崔广东不但不依法履行法定职责反而成为为群众做好事，崔广东把一个违法行为变成为好事简直是天大笑话，崔广东渎职，玩忽职守，玩弄法律，颠倒是非黑白，执法犯法，无法无天，不作为，乱作为，搞形式主义，官僚主义特别严重。举报人刘天基通过各种渠道举报违法建设市场大棚遭到山东省政府，青岛市政府平度市政府各部门的层层保护伞的保护，举报人刘天基是上天无门，入地无路，有苦无地诉，有冤无地审。请国家领导人依法严查崔广东和邓伟玉等人知法犯法，无法无天，玩弄法律，颠倒是非黑白，渎职，玩忽职守，徇私舞弊，滥用职权，欺上瞒下，对抗国家政策和法律法规定，耍法律流氓，不作为，乱作为，搞形式主义，官僚主义等违法违纪腐败行为特别严重，违反了党纪国法，请罢免崔广东和邓伟玉等人的一切职务，移交司法机关追究法律责任。举报人刘天基，山东省平度市开发区大泥河头村219号。,2020-03-27,2020-04-03
35,因沟崖村大部分口粮地被卖光，村委公示的卖地数量与实际不符，请求崂山区相关部门公示，沟崖社区早期与现在村域图各一份。 谢谢领导！,2020-03-20,2020-04-03
36,信件内容崂山区中韩街道西韩社区，年底村里发钱，标准不统一。我们家小孩前年就把户口拉回村里了，去年说拉的晚了，分不了。今年又说，后拉来的不享受分钱。问他们有什么依据？他们说就这么定的村委就说的算。听其他人说，这些钱很有可能就是故意找理由扣下不发，然后村里的几个干部自己偷着分了。而且同样的情况，村干部还有那些有关系的家里的小孩都享受分钱。请各级纪委、监察委出来查查他们，简直无法无天。而且今年村里卖了地了，好几十亿，怎么管理也不公开，这样下去早晚弄没了。市纪委、省巡视组、中央巡视组、电视台、媒体都看过来。----------------------------------------------------------请明确公开：1.社区党员与居民代表大会时间？2.社区党员与居民代表大会具体内容3.福利发放的标准和办法说不出来，一句话糊弄过去就是有鬼啊 -----、您好，对您反映的问题，崂山区政府进行了落实，西韩社区于2020年1月4日召开社区党员与居民代表大会，大会的具体内容以及福利发放的标准和办法建议到社区咨询。 你们是不是准备这么回答？ ,2020-03-27,2020-04-03
37,我是甘水湾社区居民，军人家属，农村户口，在甘水湾有合法房屋4间。2017年11月10日甘水湾社区书记薛洪果在我不知情的情况下将我的房屋拆除，将安置房房和补偿款私自处置给了唐永前。我和唐永前虽然是姐弟关系，但建房时我们各自成家，他跟我的房屋没有任何关系。甘水湾社区书记薛洪果为了谋取私利，将属于我的安置利益私自处置给唐永前。长达两年半的时间，所有证据一目了然，我的房屋没有纠纷。我多次到薛家岛办事处要求返还安置房，社区书记薛洪果以家庭纠纷为由拒绝返还我安置房。我拿着证据反映问题，而社区书记编造谎言敷衍上级，薛家岛办事处领导官官相护推诿扯皮掩盖社区书记的违法犯罪行为。我这是第5次写信，希望市长不要让您的子民绝望，希望在您的带领下百姓安居乐业，再无村官恶霸！,2020-03-29,2020-04-03
38,我是甘水湾社区居民，军人家属，农村户口，在甘水湾有合法房屋4间。2017年11月10日甘水湾社区书记薛洪果在我不知情的情况下将我的房屋拆除，将安置房房和补偿款私自处置给了唐永前。我和唐永前虽然是姐弟关系，但建房时我们各自成家，他跟我的房屋没有任何关系。甘水湾社区书记薛洪果为了谋取私利，将属于我的安置利益私自处置给唐永前。长达两年半的时间，所有证据一目了然，我的房屋没有纠纷。我多次到薛家岛办事处要求返还安置房，社区书记薛洪果以家庭纠纷为由拒绝返还我安置房。我拿着证据反映问题，而社区书记编造谎言敷衍上级，薛家岛办事处领导官官相护推诿扯皮掩盖社区书记的违法犯罪行为。我这是第5次写信，希望市长不要让您的子民绝望，希望在您的带领下百姓安居乐业，再无村官恶霸！,2020-03-29,2020-04-03
39,车文琴作为曲坊村书记不给老百姓办事，迫害老百姓，村民张瑞兰口粮被村委破坏，反映问题无数次一年多。到现在车文琴不给处理。车文琴作为领导就这样为老百姓服务？？车文琴作为领导该办的事不不办，明目张胆欺压百姓。我们要求上级领导对车文琴这样所谓的领导，依法处理。,2020-03-30,2020-04-03
40,领导您好：曲坊村书记车文琴。对村民张瑞兰口粮地的事推诿扯皮不给老百姓办事。车文琴作为管区区长，曲坊村书记光耍嘴皮。对车文琴这样滴领导。我们要求上级领导严查严办。维护老百姓利益。,2020-03-28,2020-04-03
41,您好!    请问青岛市即墨区温泉街道南北行村何时才能拆迁。望回!,2020-04-02,2020-04-03
42,在2月10号左右疫情严俊时，胶州市胶北街道办事处袁家村党支部书记袁茂猛多次放外村人进村，在2月18号 下午于家村村民孙笑话华去张仁本家修机井（他家没有自来水更涉及不到民生）通过袁茂猛的关系没有测体温等防护措施，让孙笑华自己登记写了体温，袁茂猛身为党支部书记，不为村民的健康安全着想，把党纪国法置之度外，应当严查处理！,2020-03-27,2020-04-03
43,"我是山东省青岛市黄岛区泊里镇沙岭子村村民郭建山身份证号370223196811053111，康尼尔环保科技有限公司对我家在沙岭子村的口粮地进行强拆强占，并且在不通知我的情况下把土地附着物十几年树龄的柿树 杨树 桃树 梨树多种树木给毁坏掉。 ??????? 我多次说明可以转让承包权经营权但是要按照国家法律要求以及相关拆迁补偿要求保证本人的基本权益，解决本人的基本生活养老等问题。按照《中华人民共和国土地法》第四十八条规定征收土地应当给予公平、合理的补偿，保障被征地农民原有生活水平不降低、长远生计有保障征收土地应当依法及时足额支付土地补偿费、安置补助费以及农村村民住宅、其他地上附着物和青苗等的补偿费用，并安排被征地农民的社会保障费用。按照《山东省人民政府关于调整山东省征地区片综合地价标准的批复》 鲁政字[2015]286 号规定泊里镇征地价格是62000一亩，又根据鲁自然资字[2020]1 号《关于开展征地区片综合地价调整工作的通知》规定各县（市、区）区片地价上调幅度控制在 20—50%范围内，调整后全省最低区片地价为 6 万元 /亩，也就是泊里镇征地价格在一亩7到10万之间。根据2017年《青岛市征地地上附着物和青苗补偿标准》盛果期果树移植每亩38000-50000元，土筑水渠、水池30-110元/m3?,灌木一年生以上8-16元/墩。本人一亩多口粮地三亩多果园总共四亩多地需要赔偿30-40万。全部种植盛果期果树和一些十年以上杨树，需要赔偿16-20万元。一个土筑水渠、水池，大约200立方米左右，需要赔偿6000-20000元。还有180米左右的荆棘树栅栏，赔偿价格3万元左右。并且其中一亩多口粮地需要解决一人的养老问题，按照国家最低标准替失地农民按当地养老保险标准缴纳15年的养老保险，总价在25万左右，而且在本人未签字未同意的情况下将本人的果树全部损害，两年未见收获，需要额外赔偿两年损失10万元。全部合计总价85-100万元之间。康尼尔环保科技有限公司不肯按法律和相关政策赔偿，只通过泊里镇政府支付一亩七八万元的赔偿价格，本人不同意，青岛康尼尔环保科技公司强拆强占被阻止，更是让镇政府信阳边防派出所出面，将本人强行带入派出所羁押，2020年3月2日到3月12日过连续传唤对本人进行变相羁押超过100小时。为青岛康尼尔环保科技有限公司施工争取时间。这是明显的做黑社会保护伞，国务院公安部严令公安机关不得以任何形式参与征地拆迁等工作当中，黄岛区泊里镇信阳边防派出所却每次参与其中，青岛市黄岛区信阳边防派出所所长袁守强更是玩忽职守，知法犯法，积极参与其中。????希望上级领导重视，依法征地，补偿本人损失。",2020-03-26,2020-04-03
44,尊敬的领导.河套胡庆村回迁房什么时间盖，当时拆迁承诺30个月回迁，而实际上从2016年到现在4年时间连地基都没挖，同样的拆迁河套红岛两个街道其他村都已经动工建设.有的村已经建设完毕，胡庆村全部搬走就连老人房都没留下，村民到现在看不到任何希望！请领导答复一下,2020-03-28,2020-04-03
45,您好!    请问青岛市即墨区温泉街道南北行村何时才能拆迁，望回!,2020-04-02,2020-04-03
序号,诉求,诉求时间,回复时间
46,我咨询一下，张家楼镇东石岭有什么规划，是否有合村并居，搬迁的规划,2020-03-31,2020-04-02
47,您好领导!        请问青岛市即墨区温泉街道南北行村何时才能拆迁，望回!,2020-04-02,2020-04-02
48,我们村从2018年年开始要在我们人口口粮地那建飞机场要征收我们村口粮地说一亩地给一千块钱动用社会人员威胁叫我们签字.大约又过了半年莱西国土局还是什么局的在网上发布了征地公告一亩地5.5万元，我们村所有人民去找他们要钱、可是村政府乡政府都躲着找不到人，最后没办法去了建飞机地方找有有关领导、可是他们那出黑社会样子叫来特警和派出所人员强制押走我们的村民最后还拘留24小时。天理何在叫我们本身失去口粮地又没有收入老百姓怎么活呀，难道政府就这样欺负这么一生没本事的老百姓吗,2020-03-30,2020-04-02
49,此人在微博上发表侮辱毛主席的文章，造成恶劣影响，触犯了英烈保护法,2020-03-18,2020-04-02
50,想问一下政府部门，胶东镇河里三村近几年有规划吗？,2020-04-01,2020-04-02
51,领导你好，胶东拆迁6个村，为什么葛埠岭村在中间不拆，难道这个村没有噪音吗？,2020-04-01,2020-04-02
52,尊敬的新区领导您好：  请问灵山卫街道办事处，北街 、南街、东街等几个村近几年是否有拆迁规划。谢谢,2020-03-27,2020-04-02
53,尊敬的新区领导您好：  请问灵山卫街道办事处，北街 、南街、东街等几个村近几年是否有拆迁规划。谢谢,2020-03-27,2020-04-02
54,徐官庄村前期“半亩方塘”规划建设项目已经结束了吗？还是有别的新的规划。总感觉现在跟当时的项目效果图等相差甚远。,2020-04-01,2020-04-02
55,你好！请问一下，平度李园办事处后戈庄拆迁是政府行为吗？就是想问一下拆迁前，拆迁后的问题政府给解决吗？后戈庄村委会为拆迁主体是什么意思？谢谢！,2020-03-26,2020-04-02
56,领导好：  请问大场镇肖家洼四村合村并居工作什么时候开始？计划几年内完成并居工作？  谢谢。,2020-04-01,2020-04-02
57,即墨区灵山镇索戈庄村西南面的口粮地是村民产粮食吃饭的，但是成片的口粮地里面却没有一个像样的池塘用来灌溉土地，地头的沟壑更是淤堵死了，遇到下大雨的时候地里面的粮食就被涝死，去年政府安排人员到村庄疏通河道、沟壑，但是村东面的都疏通了，村庄西南面的根本没有疏通，一个村庄为何区别对待。,2020-04-01,2020-04-02
58,我是城阳区惜福镇演礼村商业街业主，因为疫情村里主要进出路口一直封着，居民无法正常通行，我们这些商户不能正常营业，说到六月份才能解封，这叫我们怎么活呀，无法营业，房租交不上，封闭了两个月一大家子花销所剩无几，在不解封没有活路了，希望政府给予支持，谢谢。,2020-03-30,2020-04-02
59,举报人刘天基提供本人照片和身份证各一份。举报人刘天基举报平度市开发区大泥河头村西北角违法建设市场大棚崔广东和邓伟玉等人的违法行为证据确凿，铁证如山，无须诉讼，通过举报信访等是反映崔广东和邓伟玉等人违法违规违纪腐败行为的一种合法渠道。请领导严查山东省政务热线12345的回复违法建设市场大棚公开帮崔广东和邓伟玉等人弄虚作假，玩弄法律，颠倒是非黑白，承当保护伞。请严查山东省平度市开发区大泥河头村的西北角违法建设的市场大棚举报约在3万多次没有拆除，有二十多份证据证明属于严重违法建设的市场大棚，举报三年之久至今为止没有拆除。刘天基自2017年6月份开始通过各种渠道举报违法建设市场大棚大约在3万多次，有山东省，青岛市，平度市国土局平度市城乡规划局等各部门的政府信息公开，法院判决等有二十多份证据包括行政处罚等证据都认可属于严重的违法建设市场大棚。举报人刘天基申请平度市国土局依法查处破坏基本农田建设市场大棚，平度市国土局局长邓伟玉不但不履行法定职责，依法查处违法建设市场大棚反而还弄虚作假，制造假的文件，违法批地，破坏基本农田，为他人谋取私利，邓伟玉玩忽职守属于严重的执法犯法，无法无天，顶风而上，弄虚作假，欺上瞒下，不作为，乱作为，搞形式主义，官僚主义特别严重。举报人刘天基申请平度市综合行政执法局依法拆除违法建设市场大棚，平度市综合行政执法局局长崔广东不但不依法履行法定职责反而成为为群众做好事，崔广东把一个违法行为变成为好事简直是天大笑话，崔广东渎职，玩忽职守，玩弄法律，颠倒是非黑白，执法犯法，无法无天，不作为，乱作为，搞形式主义，官僚主义特别严重。举报人刘天基通过各种渠道举报违法建设市场大棚遭到山东省政府，青岛市政府平度市政府各部门的层层保护伞的保护，举报人刘天基是上天无门，入地无路，有苦无地诉，有冤无地审。请国家领导人依法严查崔广东和邓伟玉等人知法犯法，无法无天，玩弄法律，颠倒是非黑白，渎职，玩忽职守，徇私舞弊，滥用职权，欺上瞒下，对抗国家政策和法律法规定，耍法律流氓，不作为，乱作为，搞形式主义，官僚主义等违法违纪腐败行为特别严重，违反了党纪国法，请罢免崔广东和邓伟玉等人的一切职务，移交司法机关追究法律责任。举报人刘天基，山东省平度市开发区大泥河头村219号。,2020-03-25,2020-04-02
60,举报人刘天基提供本人照片和身份证各一份。举报人刘天基举报平度市开发区大泥河头村西北角违法建设市场大棚崔广东和邓伟玉等人的违法行为证据确凿，铁证如山，无须诉讼，通过举报信访等是反映崔广东和邓伟玉等人违法违规违纪腐败行为的一种合法渠道。请领导严查山东省政务热线12345的回复违法建设市场大棚公开帮崔广东和邓伟玉等人弄虚作假，玩弄法律，颠倒是非黑白，承当保护伞。请严查山东省平度市开发区大泥河头村的西北角违法建设的市场大棚举报约在3万多次没有拆除，有二十多份证据证明属于严重违法建设的市场大棚，举报三年之久至今为止没有拆除。刘天基自2017年6月份开始通过各种渠道举报违法建设市场大棚大约在3万多次，有山东省，青岛市，平度市国土局平度市城乡规划局等各部门的政府信息公开，法院判决等有二十多份证据包括行政处罚等证据都认可属于严重的违法建设市场大棚。举报人刘天基申请平度市国土局依法查处破坏基本农田建设市场大棚，平度市国土局局长邓伟玉不但不履行法定职责，依法查处违法建设市场大棚反而还弄虚作假，制造假的文件，违法批地，破坏基本农田，为他人谋取私利，邓伟玉玩忽职守属于严重的执法犯法，无法无天，顶风而上，弄虚作假，欺上瞒下，不作为，乱作为，搞形式主义，官僚主义特别严重。举报人刘天基申请平度市综合行政执法局依法拆除违法建设市场大棚，平度市综合行政执法局局长崔广东不但不依法履行法定职责反而成为为群众做好事，崔广东把一个违法行为变成为好事简直是天大笑话，崔广东渎职，玩忽职守，玩弄法律，颠倒是非黑白，执法犯法，无法无天，不作为，乱作为，搞形式主义，官僚主义特别严重。举报人刘天基通过各种渠道举报违法建设市场大棚遭到山东省政府，青岛市政府平度市政府各部门的层层保护伞的保护，举报人刘天基是上天无门，入地无路，有苦无地诉，有冤无地审。请国家领导人依法严查崔广东和邓伟玉等人知法犯法，无法无天，玩弄法律，颠倒是非黑白，渎职，玩忽职守，徇私舞弊，滥用职权，欺上瞒下，对抗国家政策和法律法规定，耍法律流氓，不作为，乱作为，搞形式主义，官僚主义等违法违纪腐败行为特别严重，违反了党纪国法，请罢免崔广东和邓伟玉等人的一切职务，移交司法机关追究法律责任。举报人刘天基，山东省平度市开发区大泥河头村219号。,2020-03-26,2020-04-02
序号,诉求,诉求时间,回复时间
61,胶州2020-2022年规划九龙街道石河小学什么时候开始建？李孟路什么时候开始修？李孟路东边的建筑什么时候能拆除？,2020-03-25,2020-04-02
62,胶州市市委领导：请问2020年是村委会是换届年吗？具体时间在几月份？,2020-03-31,2020-04-01
63,胶北南庸村有拆迁计划吗？何时拆迁？,2020-03-31,2020-04-01
64,想问问三里河办事处，现在可以开始装修了吗？需要什么手续吗？,2020-03-31,2020-04-01
65,胶州市里岔镇甘沟庄村马树国书记为了能让自己继续连任，于是给村民贿赂，以达到自己能够连任的目的，严重影响了党员的自我价值，请有关部门严惩这样的不法作风,2020-03-26,2020-04-01
66,李哥庄镇南部11个村拆迁已经快两年了，到目前为止土地、自留地、菜园等要如何处理请给个答复！我家老人的菜园不能种了，全荒了！里面种植的果树因为没有水浇和管理，也死了不少！更可气的是有人趁着没有家人管理和看护，把一些好的果树都偷着挖走了，老人回去看到一场大哭，辛苦了好几年的果园也都不像样子了，气病了好多天！这个损失如何计算？希望政府给个答复。,2020-03-31,2020-04-01
67,上合示范区海庄和后旺村什么时候拆迁或者合并社区？,2020-03-31,2020-04-01
68,                         青岛市领导你好：     我们是青岛蓝谷高新区东洼里后村的村民，青岛蓝谷高新区管委给我们投诉我们村书记王书凌的《答复意见书》，存在漠视群众利益，无视老百姓正常诉求的嫌疑。    1，在村委用工问题上，你们可以查一下我们村的村民王化喜夫妻二人，他们俩一天工没有出，却领了很多钱，你们也可以查一下，我们村村民陈升远，也是光领工钱没出工，这是典型的冒领工钱，在这个问题上，我建议公示自2011年至今的村委用工明细，让全村村民来评议一下。     2，享受国家危房改造的农户，国家有明确规定，什么人可享受，什么人不能享受，什么房子能改造，什么房子不能改造。就我们村陈克华的两间看果园的小房子，也能改造，也花了1.1万元，王文大的房子就给王化梓6千元，根本就没有改造，这是典型的浪费、贪污国家财政扶贫资金。     做为党领导下的蓝谷高新区管委，竞敢无视党纪国法，明目张胆的保护贪官王书凌，我想问一下，在众多贪污实事面前，你们能心安吗？你们对得起党和老百姓吗？你们能保住他吗？     我们强烈要求蓝谷高新区管委回避，既然国家财政扶贫资金被贪污你们不管，那么我们强烈要求查清我们村集体2000多万资金的去向，还我们老百姓一个公开、公正的说法！     我们要公正，我们要公平，我们要公开，我们需要一个和谐的家，为了我们村老百姓的安居乐业，我们不会放弃投诉，也不能避免走访！    此致上访人 ：舒青林?          13583250688上访人：陈平远            13573841194上访人：邵守江            13553039506上访人：邵守忠             15020091886,2020-03-25,2020-04-01
