序号,诉求,诉求时间,回复时间
69,2019年泊里镇泊里河西村村委通知村民，本村一块基本农田已经卖出，通知村民到村委领取卖地款(7万元左右一亩)，这块土地大体位置在，地铁13号线泊里站以北，董家口路以东，泊里三路以南，泊里西河以西。就这件事情有如下问题，请回答:1，泊里河西村上述位置农田是否已经完成土地确权？这块土地是否属于本村村民承包三十年不变？2，上述位置农田一直是本村村民的农业用地口粮地，请问，现在土地性质是否发生变化？现在是农业用地么？还是商业用地或者其他性质用地？3，这块土地现在是以什么名义买卖？是政府征收么？还是商业买卖，是否有相关手续或合同？这些信息河西村委没有明确告知村民，只通知村民领钱，村民也一头雾水。在村民不知情的情况下，村委是否有权利处置上述土地？上述问题请百忙中落实，并解答，谢谢。,2020-03-29,2020-04-01
70,中韩社区哥庄村有拆迁计划吗？,2020-03-20,2020-04-01
71,大场镇陈家小庄村什么时候能合村并居呢？,2020-03-30,2020-04-01
72,有关领导您好，我是平度市凤台街道办事处新城里（李官庄）的村民。我们村从2014年开始征地拆迁，之前负责我们村拆迁征地凤台街道办事处的窦书记对我们村的承诺一直没有实现。（之前窦书记说的都已经拍成视频保留下来)从去年开始我们村开始陆陆续续的交接安置房，我们发现其中97平方的多层户型和之前拆迁时公布的户型改变。在此期间更改建设户型没有向村民和社会公众公开，同时也没有争取居住该户型的同意，没有签署任何协议合同。眼看统一交房时间过去1年多了，还是没有人主动提出解决方案。向村领导反应问题也没有得到答复。村里流传只要接盖错户型的钥匙，就给5000元，在此表示不同意。希望有关领导看到我的问题能够给出满意答复，谢谢！,2020-03-25,2020-04-01
73,西下泊村书记朱长增雇挖掘机领着村民朱寿春，朱仕玉，朱长全，朱业海等人，在大桥南边挖河沙，已经拍照片录像,2020-03-31,2020-04-01
74,惜福镇村委不顾好几百户村民的生活出行提供便利，非常可恶！为什么邻村的王家村，李辛村都能放开车辆通行，就惜福镇村不能，就你惜福镇村比别人家村强？太不人性化！让我们村民怎么生活，怎么出去做生意！都在家等着喝西北风？你们村委给钱？,2020-03-17,2020-04-01
75,根据上级要求，为了合村并区，下一步将村里的陈欠进行彻底清理，如果有欠集体款的户要认清形势，如果不主动交，清理那么将影响你的子女升学，考研，就业，考公务员和做飞机，高铁轮船等都受到限制，受到万牵连，影响他们一生，望陈欠户三思。这是村干部王成兵在村民群里面发的，农民应分的土地分不到手，添加户口的十多年没有地，别的村为什么添加户口的能分地，？？？？？许多问题：什么叫陈欠，如果土地接政策分下去那来的阵欠，,2020-03-27,2020-04-01
