序号,诉求,诉求时间,回复时间
1,上级政府最近总提到要扶持小微个体工商户！但是在咱们青岛黄岛怎么没有体现到？？？(扶持)这两个字怎么讲？别说扶持了，我提问过五六次了，连个答复都没有！殷切期望政府有所作为！,2020-04-01,2020-04-07
2,"[""尊敬的领导：您好！我是胶州市中云寺门首路161号（胶州市小马兰州牛肉拉面馆）因本店超出经营售卖了凉菜，胶州市综合执法局要对本店进行处罚。处罚金额是五千到五万 对提交此申请，由于我店在经营中负责人不熟悉餐饮经营相关规定，违反了规定，鉴于属于初次违反，并在查处过程中，对贵局工作人员的查处给予了积极的配合，未造成社会后果。由于疫情影响，我店一直关门歇业，在此期间积极投入抗疫战线，慰问一线防疫人员，得到了社会好评，自复工复产我店自营业以来，因顾客少、经营成本高、利润低，一直处于亏损状态，不能自负盈亏。  本应该本三月一号房租到期了，因今年上几个月店一直亏损状态，到现在也没能交上。 当初我们也是拿着我们当地政府补助无息贷款十万到贵地方青岛市胶州来发展的，到现在也没能还清贷款。我们也非常着急。 对于贵局给予的   元罚款确实无法足额上缴，恳请政府帮助协调给于减免处罚。     '2020年4月2日。  申请人：韩海清""]",2020-04-02,2020-04-07
3,"[""尊敬的领导：您好！我是胶州市中云寺门首路161号（胶州市小马兰州牛肉拉面馆）因本店超出经营售卖了凉菜，胶州市综合执法局要对本店进行处罚。处罚金额是五千到五万 对提交此申请，由于我店在经营中负责人不熟悉餐饮经营相关规定，违反了规定，鉴于属于初次违反，并在查处过程中，对贵局工作人员的查处给予了积极的配合，未造成社会后果。由于疫情影响，我店一直关门歇业，在此期间积极投入抗疫战线，慰问一线防疫人员，得到了社会好评，自复工复产我店自营业以来，因顾客少、经营成本高、利润低，一直处于亏损状态，不能自负盈亏。  本应该本三月一号房租到期了，因今年上几个月店一直亏损状态，到现在也没能交上。 当初我们也是拿着我们当地政府补助无息贷款十万到贵地方青岛市胶州来发展的，到现在也没能还清贷款。我们也非常着急。 对于贵局给予的   元罚款确实无法足额上缴，恳请政府帮助协调给于减免处罚。     '2020年4月2日。  申请人：韩海清""]",2020-04-02,2020-04-07
4,老百姓只能依靠和求助中国共产党和人民政府帮助解决问题，也只有党和人民政府及各位书记，市长能帮助解决。我多次写信，不知何原因，至今未有音信。3月20日青岛日报又刊登三我活动详情和政法委书记宋永祥讲话，关健谁来管，谁来落实。当前基层最大腐败是教条主义(言行不一)形式主义(未见效果)霸气的官僚主义(掌握某种权力)属地管理(是某种保护伞)谁敢监督问责，我曾经历过，我说实话，也有证据。,2020-04-03,2020-04-07
5,老百姓只能依靠和求助中国共产党和人民政府帮助解决问题，也只有党和人民政府及各位书记，市长能帮助解决。我多次写信，不知何原因，至今未有音信。3月20日青岛日报又刊登三我活动详情和政法委书记宋永祥讲话，关健谁来管，谁来落实。当前基层最大腐败是教条主义(言行不一)形式主义(未见效果)霸气的官僚主义(掌握某种权力)属地管理(是某种保护伞)谁敢监督问责，我曾经历过，我说实话，也有证据。,2020-04-03,2020-04-07
6,你好，我是一个护士，在青岛智信医疗有限公司的一家诊所工作，在四月初离职，我是从2019年7月份入职，在年底前我一个月有时候就休一天半天辛苦攥下了的假，是想着有事用或者出去玩两天，但在年底我们诊所要搬家实在顾不开人手所以就算有事我也都推了一直没有休息！疫情期间我们都没有防护措施戴连医用口罩都不是的口罩接病号开药，二月份公司通知双休了三个周（我本来是单休），然后我想休我之前的假期公司说年前有假的全抵在双休里了！后因为一些其他原因我离职了，离职的当天公司才让我签入职劳动合同！四月份发二月份的工资结果发现给我扣了600块钱，公司说因为这个月双休所以扣钱，但我就算用我的假抵消了我的假还余下好几天！真的太气愤公司在这欺负人！拜托帮我讨个说法吧！谢谢！,2020-04-07,2020-04-07
7,你好，我是一个护士，在青岛智信医疗有限公司的一家诊所工作，在四月初离职，我是从2019年7月份入职，在年底前我一个月有时候就休一天半天辛苦攥下了的假，是想着有事用或者出去玩两天，但在年底我们诊所要搬家实在顾不开人手所以就算有事我也都推了一直没有休息！疫情期间我们都没有防护措施戴连医用口罩都不是的口罩接病号开药，二月份公司通知双休了三个周（我本来是单休），然后我想休我之前的假期公司说年前有假的全抵在双休里了！后因为一些其他原因我离职了，离职的当天公司才让我签入职劳动合同！四月份发二月份的工资结果发现给我扣了600块钱，公司说因为这个月双休所以扣钱，但我就算用我的假抵消了我的假还余下好几天！真的太气愤公司在这欺负人！拜托帮我讨个说法吧！谢谢！,2020-04-07,2020-04-07
8,你好，我是一个护士，在青岛智信医疗有限公司的一家诊所工作，在四月初离职，我是从2019年7月份入职，在年底前我一个月有时候就休一天半天辛苦攥下了的假，是想着有事用或者出去玩两天，但在年底我们诊所要搬家实在顾不开人手所以就算有事我也都推了一直没有休息！疫情期间我们都没有防护措施戴连医用口罩都不是的口罩接病号开药，二月份公司通知双休了三个周（我本来是单休），然后我想休我之前的假期公司说年前有假的全抵在双休里了！后因为一些其他原因我离职了，离职的当天公司才让我签入职劳动合同！四月份发二月份的工资结果发现给我扣了600块钱，公司说因为这个月双休所以扣钱，但我就算用我的假抵消了我的假还余下好几天！真的太气愤公司在这欺负人！拜托帮我讨个说法吧！谢谢！,2020-04-07,2020-04-07
9,尊敬的市北区政府领导您好:我2019年8月30日入职青岛城市建设集团下属公司青岛城建物业管理有限公司市北区劲松三路22号青岛印象山小区上班入职第一天在我不知道的情况下签了两只纸，后来每天上班十二个小时 节假日正常上班也没有三倍工资礼拜六日也上班 就给了每月休息四天 而且每天上班也不给加班费严重超出劳动法规定时间，我上班六个月时间里也没有签合同 天天上班十二个小时 节假日上班也不给三倍两倍工资加班费等等  辞职和财务要辞职证明也不给说废纸一张，于是我去了市北区劳动仲裁申请了仲裁不过立案后迟迟不开庭这让人都怀疑里面是不是有啥猫腻什么的，请市北区政府以公平公正无私来处理这件事，,2020-04-06,2020-04-07
10,刚刚电话号码给错了  还是询问 办理劳务派遣经营许可证 需要什么材料 谢谢,2020-04-05,2020-04-07
11,询问办理劳务派遣经营许可证需要什么材料 看到请回复 谢谢,2020-04-05,2020-04-07
12,"本人2016,4-2017,6在青岛工作,单位给交五险,2017年9月起我到烟台工作至今,现在我想把青岛的保险转移到烟台,请问怎么操作,山东政务服务网的办事服务里的咨询电话打了一圈全都忙线,急的我想打监督投诉电话了都,烦请人社局和医保局回复,电话回复也可,18561037326,",2020-04-07,2020-04-07
13,以下是上次提问的答复：青岛高新区党群工作部:市民您好！来件已收悉。根据《合作办学协议》，青岛实验学校教师招聘采取自主招聘的形式，对于事业编制教师招聘，招聘简章由上级主管部门审批后面向社会发布，招聘后集中办理事业单位入职手续。在事业编制教师不足的情况下，青岛实验学校招聘合同制教师，签订劳务派遣合同。感谢您对高新区的支持与关注！,2020-03-31,2020-04-07
14,我今年3月6日退休，为什么今年退休工资计算，社平工资要按2017年的社平基数？并且为什么不按青岛社平工资算，而按山东省社平工资算？,2020-04-03,2020-04-07
15,2020年4月1日晚的青岛电视二台的生活在线节目播出了，一个不签劳动合同和不交社保和欠薪的新闻。这个新闻中，那个男老板居然在电话里告诉记者说他不熟悉相关规定，记者和劳动局以后不要听这种借口，公司的负责人和人事部的人建议应该直接推定为他们非常熟悉相关规定。这个男老板还说有些职工是自愿不要社保的，这是不是天大的笑话？自愿不要五险一金是可能吗？别的公司，到现在那种入职必须签自愿不要社保的协议还是经常发生，明明是公司不给社保和不签劳动合同，却让职工签自愿或者要求公司不给社保的协议，实在天理难容，职工这个时候一定要录音录像，公司如果用这种协议来诽谤是职工不要社保的，怎么办？如果所有的公司都这样，怎么找工作？就像明明是公司想违法辞退，结果却让职工签因为自己原因辞职的申请，如果所有的公司都是让入职职工签署，所有的劳动权利都自愿放弃和所有的责任都自愿承担的协议，当然也包括必须自愿不要五险一金才能录取你的协议，那职工去火星上工作吗？劳动局千万要严格监管，那种公司就是不给社保，职工爱干不干，并且诽谤是职工自己不要社保的公司。如果出现这个口罩厂的口罩就是1000元一个，别人爱买不买，并且诽谤是别人自愿购买的和恶意索赔，这种卑鄙的霸王条款思想和诽谤购买人的行为，一定要严格监管。相关纪委监委可以考虑查查劳动监察以前是怎么监管的，有没有监管责任？劳动监察的调查结果是不是黑白颠倒的真相信了公司所说的是职工自愿不要社保的？是公司不给社保，结果公司通过让职工签自愿不要社保的协议颠倒事实真相，职工为了求职没有办法，就像某些人紧缺口罩，没有办法才购买，以后公司让入职职工签的任何，对公司有利的和公司逃避义务的协议，都无效和必须重罚公司和公司负责人个人。劳动监察的关注重点应该是公司的违法违规行为，事情是因为公司的违法违规行为诱发的，让公司不敢违法违规了，让公司及时交社保和不要拿出来霸王条款的协议签，别的事也就没有了，这才稳定，如果不关注公司的违法违规行为，如果打着居中处理的旗号帮助公司诽谤职工，千万不能老是找职工的缺点和破绽，这可能是腐败和玩忽职守激化社会矛盾，到时候社会现象就可能使某些真相水落石出了。,2020-04-02,2020-04-07
序号,诉求,诉求时间,回复时间
16,你好，想咨询一下在青毕业生住房补贴的发放方式可不可以更改？我目前选的是社保卡，可不可以改为农业银行储蓄卡？具体怎么操作？谢谢！,2020-04-04,2020-04-07
17,本人2006年参加工作入社保，2008年辞职创业，同年社保暂停缴纳，期间有老式的磁条社保卡，现在已然废除了，换芯片卡了。2019年重新开始上班，新公司开始缴纳社保，得知新公司的社保都是青岛银行的，请问我这种情况是否可以自己去合作的青岛银行办理个人医保卡?如果可以的话带什么资料如何办理？因为就我一个人的不想麻烦公司去给办，想自己去办，期待回复，谢谢！,2020-04-04,2020-04-07
18,领导你好，咱们本科生住房补贴每次申请完十天内就到账了，为什么系统还要在审核两个月，咱们平台能快点吗？保证每月都可以领上个月的？,2020-04-03,2020-04-07
19,我户籍在三亚，持三亚社保卡，是黄岛区的公务员，请问能享受本地居民的医保待遇吗？就医能否用三亚的社保卡？,2020-03-27,2020-04-07
20,领导你好，咱们本科生住房补贴每次申请完十天内就到账了，为什么系统还要在审核两个月，咱们平台能快点吗？保证每月都可以领上个月的？,2020-04-03,2020-04-07
21,根据国有关法律法规的规定，企业必须无条件给员工缴纳五险。而现实是我经历过和看到的好多企业特别是中小企业给员工缴纳五险的少之又少，有些企业说是缴纳其实只给办公室的交。普通员工真是又气又急。我想问有关部门，是民不告官不究呢还是你们的行政不作为？请给一个合理的解释。谢谢！,2020-04-03,2020-04-07
22,"申请代理记账资格提交资料中,2,2,持有会计从业资格证书的专职从业人员不少于3人,3,3,主管代理记账业务的负责人具有会计师以上专业技术职务资格或者从事会计人员工作不少于三年,且为专职从业人员,第一,现在会计从业资格证书已经取消,专职从业人员怎么认定呢,第二,从事会计人员不少于三年,是提供简历,如果不是,那提供什么证明材料呢,第三,专职从业人员不少于3人,是否包含着负责人呢,负责人本身就是员工之一",2020-04-03,2020-04-07
23,请问新教师入职当年有没有本年度半年的精神文明奖？同一批进学校，老教师就有，新教师就没有。崂山区，市南区，西海岸 城阳区，2017 2018 2019年入职的新教师都发了半年的精神文明奖，李沧区为什么扣发？是没有财政预算还是扣发？,2020-04-03,2020-04-07
24,河套红岛农民响应国家号召，积极配合棚户区改造，而政府承诺的养老金迟迟没有解决，特别是年龄大的老人，不知有生之年能否享受到党的温暖，强烈建议先给65岁以上的老人一次性补偿养老金，学习胶州机场搬迁政策,2020-04-02,2020-04-07
25,河套红岛农民响应国家号召，积极配合棚户区改造，而政府承诺的养老金迟迟没有解决，特别是年龄大的老人，不知有生之年能否享受到党的温暖，强烈建议先给65岁以上的老人一次性补偿养老金，学习胶州机场搬迁政策,2020-04-02,2020-04-07
26,尊敬的领导：我是青岛市公安局开发区分局的一名派出所辅警。2020年1月27日根据市局通知提前结束过年休假，投入疫情防控工作一直到现在。我想问一下为什么同一个派出所有部分辅警就可以不用来上班？同样的工作岗位他们就可以在家不来上班，而我们却一直坚守工作岗位。甚至都有很多人到了2月底才来上班，甚至直到现在还是有很多人经常不来上班，为什么他们都不来上班却拿着和我们一样的工资?为什么他们的考勤表上却都是全勤上班？这种现象已发展成为常态。这对冒着疫情风险一直坚守工作岗位的我们来说，公平吗？,2020-04-03,2020-04-07
27,"私营企业以效益不好为由，随意苛扣工资，加班费等问题，单位招聘本市40.50人员，享受政府税收补贴，现在物价怎么高，单位还开2000块钱左右，2016时开2600元左右，直接降了600,有没有说理的地方。",2020-04-02,2020-04-07
28,"没找到企业名称自主申报承诺书上传的地方,",2020-04-03,2020-04-07
29,我是黑龙江省的外来务工人员，现在在青岛市一汽物流公司下属的蓝石物流公司当汽车配送司机。拖欠运费3000多，各种理由推脱不给结账。以前在吉瑞泰物流公司李德贵队长带领也是拖欠3000多，人消失联系不上了。投诉过，没人理。传闻政府有人，不会有处理的。我不信试试，有人管没！,2020-04-04,2020-04-07
30,区长你好。我在彤顺德火锅店干了7个月，老板故意不给开工资。拖欠了4个月工资，23000元。找可劳动局去投诉，劳动局核实后，让我等老板信息。但是现在是老板，还有劳动局为什么都在没有声音了。我们7-8号人。难道就不能通过合法渠道要出工资吗？非得逼的我们用非正常的方法来要回我们的血汗钱吗？我们是被逼没法了，年前4个月不开工资，年后3个月没工作。区长，给帮帮忙吧，,2020-04-05,2020-04-07
序号,诉求,诉求时间,回复时间
31,"关于转移至临沂市河东区,但在临沂市河东区政务大厅未查询到有效信息,显示姓名,身份正好,个人账户不匹配,个人账户与职工编号是一样的吗,该如何办理转移,",2020-04-02,2020-04-07
32,由于疫情我们遇到切实的问题马上面临破产，员工面临失业。我公司主要的业务是针对学校和大酒店。从疫情开始我们一直认真执行国家的政策：一直都是按政策给员工如数的发放工资。目前我个人的信用卡都已经刷报警了。从2011年我们公司成立以来一直谨遵国家政府的政策该交的税我们都交了。疫情来了要捐款我们不管多少也捐了。我是停薪留职人员社保有原单位承担我个人只交一少部分。就因为我的社保不能在这里交、所有的优惠政策我们都得不到。目前已到了破产员工失业的边缘。望政府能给予妥善解决。,2020-03-26,2020-04-05
33,希望大大们连上丰城镇,2020-03-29,2020-04-04
34,青岛市医保中心业务办理电话：85712877和市南医保中心义务办理电话永远占线，什么时候都打不通，我怀疑他们根本就是把电话放在一边不接听，我办理的是外地医保转移到青岛本地，网站上却也怎么也办不好，已经办理超过一个月了，也没有任何进展，电话也打不通，青岛就是这么欢迎外地人员来青岛就业的？办理手续这么繁杂，为什么青岛2019年人才净流入才10万人？,2020-04-02,2020-04-03
35,"增加个体经营项目,网上申报流程怎么操作,能否告知",2020-04-02,2020-04-03
36,胶州市胶北办事处小区防疫人员有没有防疫补贴？什么标准？从正月初四就已经上岗，目前已经值班到4月9号了，请问有补贴吗。,2020-04-02,2020-04-03
37,疫情期间。沙子口街道天天安排人员上班，从初二上午通知，初二下午开始上班。大过年的，一大堆人一起上班。不怕传染？然后安排人员天天在小区门口值班。早上7点开始到晚上22点。有的小区24小时值班，从初二开始到今天3月31号天天值班加班。一分补助没有。连续工作60多天，一天没休息？公务员就是朝九晚五，高高在上吗？请问这是拿着人当钢铁侠？敢问贵单位。疫情期间谁规定的这个工作时间？每天晚上10点下班回家打车？早餐不管？一个月工资，不够打车费，甚至晚上打不到车，走很远的路才碰到。政府单位就这个样子吗？,2020-03-31,2020-04-03
38,“根据《国家税务总局关于发布〈税务文书电子送达规定（试行）〉的公告》（国家税务总局公告2019年第39号）的有关规定，国家税务总局青岛市税务局于2020年4月1日起实现税务文书电子送达。>”税务经常出现使用数字证书等电子报送的情况，但没有发现如何去哪儿怎么办理数字证书的内容，企业在开办时，由于公积金缴纳，均已办理“CA数字证书”用于公积金网上营业厅。请问该证书是否可直接应用于税务？还是需要额外办理？能否“一证书多用途”，不然税务，公积金各种均需办理多个证书，也是资源浪费,2020-04-02,2020-04-03
39,市长您好，我想提一下意见，订购口罩的所有的订单能不能统一查到,2020-04-01,2020-04-03
40,各位领导：    您好，我是青岛地铁站务部2529名员工中的一员，2020年3月26日，接上级领导通知，在上班后我们需要“被掏兜儿”。事发起因源于因地铁运营行业的特殊性，值班站长及以下员工上岗期间不允许带手机，但近阶段因疫情原因有极小部分员工在岗期间查看手机信息，导致个别领导愤慨后粗暴下达值班站长在巡站时需要让员工“自行自愿”将裤兜内物品掏出的规定，值班站长如不执行，上级领导发现有员工私带手机上岗等情况将一并提级处理。在此我们2000余名一线生产员工有以下几点质疑，请市主管部门相关领导予以解答：    一.“胁迫”值班站长要求员工“自行自愿”掏兜儿是否合情合理合法？    据相关法律所示，青岛地铁作为企业尚无相关人身搜查权，《宪法》第37条规定：“中华人民共和国公民的人身自由不受侵犯。任何公民，非经人民检察院批准或者决定或者人民法院决定，并由公安机关执行，不受逮捕。禁止非法拘禁和以其他方法非法剥夺或者限制公民的人身自由，禁止非法搜查公民的身体。《行政诉讼法》第11条第2项规定：人民法院受理公民对限制人身自由的行政强制措施不服的行政诉讼。最高人民法院于1991年6月11日发布的《关于贯彻执行<中华人民共和国行政诉讼法>若干问题的意见（试行）》第2条规定：“根据行政诉讼法第11条规定的受案范围，公民对劳动教养管理委员会作出的劳动教养的决定不服的，可以向人民法院提起行政诉讼。公民对公安机关作出的强制收容审查的决定不服的，可以向人民法院提起行政诉讼。”对侵犯人身自由权的犯罪行为，公民则可以依据《刑事诉讼法》第13条、第59条的规定，向司法机提出控告和检举。    二.为避免班组长上班玩手机，站务部特采购一批价格较为昂贵的“移动互联网终端”是否合理？    青岛地铁3月2日起，站务3车间正式施行值班站长上班严禁携带私人手机的禁令，工作期间均使用部门配发的移动互联网终端，其淘宝售价为5000元左右，仅三号线22各站便需花费国有资金110000元，其所配手机卡为站区长开户，话费由公司买单。以上花费是否合理？是否有必要花费11万元来防止极个别员工的过失？   三.青岛地铁站务部管理岗人事任用是否需要作出调整？    以上举措均需得到车间管理岗、部门管理岗及公司高层领导的授权，类似胁迫值班站长要求员工“自行自愿”“掏兜儿”的荒唐事宜在站务部不在少数，但从官方口径发出，能够取得确切证据的为数不多，以上要求是到得了朱姓领导的授权？还是沙姓领导的肯定？还是高姓领导的授意？还是柴姓领导的支持？我们不得而知；采购万元“移动互联网终端”来防止值班站长玩手机更是荒唐可笑。以上操作是否可以理解为相关管理岗管理思路的拙劣呢？   以上，仅为站务部千余名普通一线员工的质疑，请上级领导详查，确保国有企业的清廉形象与行业正气。,2020-03-26,2020-04-03
41,青岛即发集团华和针织有限公司二厂：车间领导贪污受贿、工人工资与实际工作量严重不符、谁送礼谁不用干活、不送礼的就让我们拼命的干活、到月底不干活的比我们干活的工资上学差距太大！以前同事离职之后回来要保险、一拖再拖、红包600-800之间给予一定的好处费、合同才能给、什么风气！是谁给一个车间主任如此放纵的权利！恳请政府领导帮忙解决、这严重败坏我们青岛的社会风气！,2020-04-02,2020-04-03
42,"您好,我单位想申请测绘资质,需要满足什么条件,还有具体流程,初次申请可申请级别有哪些,另外公示电话0532-85916498一直没人接,请问是否有别的咨询电话",2020-04-02,2020-04-03
43,这个电子身份证政府保安都不认，还要这个有什么用，还要原件？这个APP的意义在哪，用来搞笑吗,2020-03-26,2020-04-03
44,现在体现不到政府对小微个体工商户的扶持，原因是我家开个超市现在资金周转不开，面临倒闭。想要贷点款。但是贷不出来！,2020-03-27,2020-04-03
45,尊敬的领导：您好！    我想问一下，现在是2020.3.25日，我们公司2020.1月的工资还未发放，我于2020.3.13日向公司提出辞职，辞职时说是3月底走，现在3月我们领导找的人还未到位，他就不让我3月29走，我想问一下，我这个样发放工资还必须1个月走吗？我如果不用提前1个月走，需要怎么办呢？需要收集什么资料呢？证明自己？,2020-03-25,2020-04-03
序号,诉求,诉求时间,回复时间
46,今天干活的时候看着俺公司三楼板房车间墙板是泡沫的。不是不让用了吗？会不会有危险？俺公司是青岛明药堂医疗股份有限公司,2020-04-03,2020-04-03
