序号,诉求,诉求时间,回复时间
47,想问一下为什么崂山，即墨，高新区等地辅警工资最低到手3500元，还有一金，为什么单独城阳区辅警工资才2200元左右？差距也太大了吧？城阳区喊改革口号喊了很多年也没有落实到位，是不是有些人克扣辅警工资？把给辅警的工资瓜分，装进自己得罪腰包？希望调查清楚，把我们的工资涨上去，要不就没办法生活了,2020-03-30,2020-04-03
48,"本人2015年在青岛上班,在2016年离开青岛,但是社保及住房公积金没有做处理,现在想把住房公积金和社保转到深圳,但是我又去不了青岛,请问如何在网上办理",2020-04-01,2020-04-03
49,"以前交过公积金,时间大概是2010年,当时因公司倒闭l离职,以后没有再交公积金,本人是农业户口,取了以前交的公积金,现在就业的公司要缴纳公积金,不能开通,找不到以前的公司办理转移怎么办,",2020-03-31,2020-04-02
50,请问在建筑企业资质办理过程中，建设厅发证的技术工人必须要提交的材料中提供技术工人系统用户名和密码吗？要在本单位技术工人系统下可查询吗？还是说企业给缴纳社会保险就可以认定？需要企业提供用户吗和密码以及要查询是否在本单位的依据是什么？,2020-04-01,2020-04-02
51,2020年3月31日，即墨区发放2019年下半年的个人绩效工资，但是个人绩效工资总数被扣600元，这是政府违法扣除个人绩效工资。为什么个人绩效工资总数被扣600元？这是按照国家的要求根据绩效考核发放绩效工资？请将被扣除的600元返还给个人。,2020-04-01,2020-04-02
52,公司统一改换签合同，之前和用人单位直接签合同，现在公司突然通知下月开始换另一家劳务公司签合同，工资待遇暂时不变，等于把正式员工全部外包出去。要么签，要么走人，请问这样合法吗？,2020-03-30,2020-04-02
53,各位相关领导们，你们好！最近网上开始灵活就业人员社保补贴政策，但设置很多门槛，一个是相关社保部门只能网上申报，这对于不会上网人员是个难题，另外设置领取条件过于复杂，本身是个好政策，操作起来老百姓根本感觉不到温度！更像鸡肋，诚意减分！       不知道个体属于不属于灵活就业人员，不能因为有了张营业执照就不算灵活就业啊？要看营业额，。都半年没开出一张发票。。。困难的要死，竟然还不算灵活就业人员？总之一句话，请政府指定政策，尤其好的政策，拿出点诚意，不要宣传得很好听，最后老百姓得不到实惠！         成了一场自我标榜成绩的自嗨秀！,2020-03-31,2020-04-02
54,为什么机关单位的非在编员工没有精神文明奖？工资本身就低,2020-04-01,2020-04-02
55,我家老人在2019年3月份去世！我们申请了殡葬费和抚恤金有半年多钱没有发放到位！又去申请急用把一部分发给我们了！剩余一部分直到2020年4月了一年多没有全额发放到位！请问我们的钱什么时间收到！,2020-04-02,2020-04-02
56,我是胶南市民王同明，2020年3月30日，我在西海岸不动产登记中心（西区）办理抵押登记业务。由于自身原因，到达营业大厅已经临近下班，但大厅内等候办理业务的仍然人头攒动，我非常着急，担心我的抵押业务处理不完，我就不能及时得到银行贷款。转眼间到了下班时间了，前面等候处理业务的人仍然不少，这时一名主管为我们这些尚未被叫号的等候办理人员统筹分配了对接窗口。到我们办理业务时，已经接近17：30分了，还记得好像是55号窗口的办事员，他的同事们都陆续下班离开了，而他一点没有怨言，仍旧热心的为我们服务。由于情况特殊，我们这项业务需要协调档案、审核等环节岗位，这名办事员又立即向相关领导请示，给我们协调了各个岗位（部门），各岗位并没有因为下班而推诿，甚至有些岗位是因为我们这笔业务回家又折返回来的，终于顺利完成我们的抵押登记业务，我们离开时天色渐晚，大厅里几乎已经空寂无人，为我们办理业务的那个55号窗口灯火通明，我猜测那个小伙子还要日结等后续处理完成才能离开，我们满怀感激离开了，但我知道，这为我们延时服务的是一个团队，很多人默默的付出了本该属于自己的休息时间。这种做法正是全心全意为人民服务的体现，是新时达勇于担当的表现，这说明西海岸不动产登记中心（西区）有协调统筹的好领导、全新为民的好员工、机动灵活的好制度，在此我对西海岸新区不动产登记中心（西区）表示由衷的感谢！,2020-03-31,2020-04-02
57,"您好,我的社保想从青岛转出,现查询发现有个社平调差缴费未交,想请问这个事必须本人或者原单位人事去代缴吗,授权其他人去缴纳费用是否可以,",2020-04-01,2020-04-02
58,尊敬的领导，您好，我想咨询一下城阳区乡村医生防疫补助什么时候发？按照什么标准来发？城阳区最低基本工资1900为何我们工资才1200，加上绩效才1900。绩效工资跟基本工资能一样吗？工资太低了，工作有苦又累，待遇确是很低很低。说是五险一金，也就是社保里面最低档的最低基数。现在我们是拿着最低的工资，享受着最低的保险，干着四五个人的活。请领导关心一下我们,2020-03-26,2020-04-02
59,我想咨询一下，我家开了一个130平米的超市，现在资金周转不开了，问能不能在银行贷点款？在什么银行能贷？应该具备什么条件？,2020-03-26,2020-04-02
60,领导您好，我是城阳区一名乡医。今年与卫生院签订劳动合同，工资变成了1200，而没有签合同的乡医工资变成了2500。卫生院答复是就把补助的钱给我们买保险了，跟不签订劳动合同待遇如是一样的话，那我们整天熬夜学习考取医师资格证这些现在反倒不如没有医师资格证的挣得多？如与卫生院职工同等待遇，是否会有十三月工资？医院的一切福利是否会享受？防疫补助什么时间发放？,2020-03-27,2020-04-02
序号,诉求,诉求时间,回复时间
61,私营企业以效益不好，随意苛扣工资，加班费等问题，疫情期间只发了一个口罩，一个防护罩，戴到现在。请问应该找哪个部门投诉，青岛市就没有能管理私营企业的地方吗？欺人太甚。,2020-04-02,2020-04-02
62,本人前公司欠缴公司员工社保已有一年，且多次协商无果，严重耽误员工基本生活保障以及医疗报销等，希望政府部门能出面为群众做主，强制执行等，事关人民群众的切身利益，谢谢,2020-04-01,2020-04-02
63,你好，我想问一下我们李哥庄政府人员在一线值勤的双倍工资什么时候能发下来？,2020-03-28,2020-04-02
64,《住房公积金管理条例》和《青岛市住房公积金缴存管理办法》规定，本市行政区域内的国家机关、事业单位、企业、民办非企业单位、基金会、社会团体等组织应当为其在职职工缴存住房公积金。在职职工是指与单位存在劳动关系，在单位中工作并由单位支付工资的各类人员。单位录用职工的，应当自录用之日起30日内向市住房公积金管理中心办理缴存登记，并办理职工住房公积金账户的设立或者转移手续。单位应当按时、足额缴存住房公积金，不得逾期缴存或者少缴。单位欠缴职工住房公积金的，应当按国家有关规定将欠缴的住房公积金，补缴至职工住房公积金账户。城阳街道联防队员与城阳思达签订三方劳动合同，未给在职联防投公积金，请住房公积金中心依法处理。,2020-03-30,2020-04-02
65,城阳区城阳街道雇佣联防队员与思达劳务公司签订派遣合同，思达公司却不给在职联防队员投住房公积金，违反国家颁布<<住房公积金管理条例>>第三十条规定，投住房公积金是国家强制要求，联防队员也从未放弃享有权益，请住房公积金管理中心督查，按照法律规定处理。,2020-03-29,2020-04-02
66,1根据青岛市有关规定，所有企业2019年6月起应该给农业户口职工缴纳公积金，多次反应要求青岛青食有限公司给职工缴纳2019年6-12月份公积金，时至今日一直没有缴纳！2  企业在没有经营困难，反而利润一直连续每年增长的情况下给青食有限公司下调保持了若干年的公积金缴纳比列，就是因为要给企业这一百多个农业户口职工缴纳了就立马下调了吗！！！！3肯定有关规定企业缴纳比例为统一比例，请按照青食有限公司2019年得公积金缴纳比例补交2019年6月到12月的公积金！,2020-03-27,2020-04-02
67,为什么青岛明药堂医疗股份有限公司，发国难财赚了几千万，一个口罩卖16。为什么还给我们拖延发工资？为什么劳动局又不管了，快来吧还能给你拿几个口罩带。我们办公室人员晚上加班费也不给了。是不是应该查查哪个人收了口罩,2020-03-27,2020-04-02
68,收到96606的短信，因为疫情期间，都在家不出门，献血的人很少。急需要献血，打96606无数次电话咨询，始终打不通，96606是摆设，虚设的吗？既然给我发的短信，需要献血，为什么电话打不通？,2020-03-30,2020-04-02
69,青岛市领导你好：     我是青岛即墨蓝谷高新区东洼里后村村民，我求助青岛市领导能够督促青岛市即墨省级高新技术开发区管委给我解惑。           2019年12月24日，我向山东省人民政府信访局的信件转交青岛市即墨省级高新技术开发区管委(以下简称华山政府)办理，华山政府说是给了巜答复意见书》，我想知道华山政府给的巜答复意见书》的内容是什么？以什么形式给的，又是谁收到的。希望能给我解惑。    2019年12月26日，我向山东省人民政府信访局的信件转交青岛市即墨区华山政府办理，华山政府给我出具了“不再受理告知(超期末提出复查申请),2020-03-26,2020-04-02
70,领导好  城阳很多复工企业 中午午休甚至要1个半小时  疫情期间能不能减少这样的接触时间呀   ,2020-03-25,2020-04-02
71,3月14日下午13时左右我因车辆问题进青岛广兴现代4s店维修，4s店员工操作机械不当导致我脚被压骨折，需要卧床休息三个月，到现在过去10多天，不给说法也不给处理，连基本的医药费都不想承担，多方沟通无果，老百姓维权难，希望政府能为我做主,2020-03-26,2020-04-02
72,各位领导好，继续投诉，请给予解决，谢谢,2020-03-16,2020-04-02
73,目前仍有公司拖欠员工工资与社保长达一年之久，向劳动部门反应其审理过程所用时间非常长，严重耽误员工的各项权益包括医疗报销等，建议劳动部门应该主动审查各个公司的缴费情况，不要总是只等人举报投诉，且有时候还处理不明白，对于欠缴社保等情况劳动部门应该主动向企业敦促缴纳并做出相应处罚，对于投诉应在一周内处理完，该强制执行要强制执行,2020-04-01,2020-04-01
74,"我公司在青岛李沧区注册,因工作缘故需在胶州地区开设分支办事处,需要如何才能快速申请,提交什么材料呢,",2020-03-31,2020-04-01
75,领导您好，市政企业办理安全生产许可证使用建设厅发证的特殊工种，但是市政企业无法开通特殊工种系统，不能办理变更注册，请问这种情况该怎样解决？可以注册在别的公司，然后社保在本单位进行申报吗？,2020-03-30,2020-04-01
