序号,诉求,诉求时间,回复时间
38,技能补贴茶艺师 评茶员 健康管理师一直未审批发放,2020-03-23,2020-03-25
39,疫情现在还没完全结束，也不大敢出门，但我们想开一个农药店，向哪里申报啊，能不能给个电话啥的问问？,2020-03-25,2020-03-25
40,咨询：黄岛区（胶南市）视力评残应该去哪？具体应该怎么办,2020-03-20,2020-03-25
41,精神分裂症住院好了   精神分裂症鉴定需要多钱  怎么鉴定,2020-03-10,2020-03-24
42,2019年12月已申请的困难人员补贴，什么时候能到账,2020-03-23,2020-03-24
43,请问，有没有老年人免费治疗白内障的医院或者优惠政策,2020-03-22,2020-03-24
44,"尊敬的领导：您好！希望领导对我工作期间发生事情 明察秋毫 换我本人一个公道！致谢！   事情发生在2013年上半年，在2012年参加市南区计生专干公开招聘考试，成绩合格被录取，被分配原红岛路社区，从事计生专干工作，因为郝萍萍一直跟随我扰乱我正常工作。后来被调到珠海路街道东海中路社区从事计生专干工作，自来到珠海路街道东海中路社区一天8小时不停的工作，开始计生工作非常多，市南区卫计局抓的很紧，没时间聊天说话，除了工作还是工作，计生档案一一查找、落实真实的信息登录计生档案，如：区域育龄妇女、 流动人口，妊娠分娩补助 网络房屋住宅登记等等 以上工作基本由我一个人完成，东海中路张波欺骗我4年，张波在担任社区主任期间......行为淫秽与街道武装部主任不干正事，两个人天天早晨8点左右不开灯相互在东海花园一楼社区主任办公室摸，有一次早晨被我撞上，张波编造理由是：卫计局停止我的工作？？？我觉得张波女人没有揭发她，加上市南区一位领导把我调动工作，内心非常感激，忍下这口气，事后为退休金之事？我越想自己愿望，为了查清楚此事，开始调查我事情、包括郝萍萍近几年干坏事一一被我查实，郝萍萍自从被八大关街道撤职后，暗中挑拨红岛路帮到家和居民闹事等、外号郝大彪子贩卖避孕工具；张波在工作期间:我亲眼目睹张波和计生主任王永红给我编造“居民考核不合格”并且上面还有2人签字，害的我待岗4年，期间社区对我本人诽谤造谣无人不消，65个社区计生专干没有人不知道的，搞得我在众人面前抬不起头来，更严重的是社区主任张波和计生主任王永恒模仿居民签字？？？挪用计生协管员和税务普查资金吃喝玩乐，例如：每周二次下饭馆、中午顿猪蹄、到市立医院饭堂购买熏鱼、包子、平日崂山绿茶、水果不断、早晨10点左右街道主任过去嗑瓜子喝茶下午5点下班。张波属于社会渣滓，不懂管理，期间每次街道要求写社区工作情况？街道主任帮忙搞定。此事反映多次至今没有解决，现在我要追究责任多年前“居民考核不合格”材料不翼而飞了 追究4年+我退休4年 到现在街道没有处理，张波和王永红利用职务之便，合伙分赃贪污社区物资财务购买食品：如：崂山绿茶 新鲜水果 每周二次下饭馆等等 冒充计生协管员签字每人50元/月和 税务普查签字每户20元等 ,期间2个人相互监督谁不敢分钱，平日用来吃喝玩乐，请查明实情 还我公道，补上待岗期间工资，从2013年上半年到现在。",2020-03-15,2020-03-24
45,尊敬的政府领导       你好，我有亲戚在青岛西海岸泊里镇草桥村，现在听说青岛西海岸泊里镇草桥村及周边的一些村庄要在清明节前后进行墓地搬迁，现在疫情期间是不是不应该组织这样大规模的人员参与事件，还望政府有关部门考虑一下是不是等疫情结束之后再进行该事件。,2020-03-16,2020-03-24
序号,诉求,诉求时间,回复时间
46,老人2019年12月27日去世，那交的2020年的医疗保险可以退吗？,2020-03-10,2020-03-23
47,领导您好，根据疫情指挥部安排，为减少人员聚集，消除疫情传播扩散风险，保护广大群众生命安全和身体健康，根据《国务院应对新型冠状病毒感染肺炎疫情联防联控机制关于进一步做好民政服务机构疫情防控工作的通知》要求，现将清明节期间祭扫有关事项通告如下：一、今年清明节期间，全市各殡仪馆、公墓、骨灰堂等殡葬服务场所，继续暂停群众现场祭扫活动，暂停组织集体性骨灰撒海、生态安葬等活动。二、禁止在道路、广场、居民楼院及山头、绿地等公共场所焚烧抛撒各种丧葬祭奠物品。三、倡导通过家庭追思、网上祭扫等方式寄托哀思、缅怀故人。市民可登录青岛市殡葬事业服务中心网站、青岛殡葬96444微信公众号进行网上祭扫。为了您和他人的健康安全，敬请广大市民理解、支持和配合!青岛市新冠肺炎疫情防控指挥部办公室2020年3月17日请问今年清明之前泊里镇是否继续搬迁坟墓？如果搬迁是否与疫情指挥部的精神相违背,2020-03-18,2020-03-23
48,我是2010年最后一批城镇户口带安置卡的退役士兵.我觉得青岛市退役军人事务局应该把国家的政策落到实处.201个退役士兵管理岗位有多少？安置率有新闻媒体宣传的那么高？安置工作公开性都存在纰漏.（在选工作时不公开工作内容）选岗时承诺的没有司机保安保洁服务员.都做到了吗？硬性安置的事情都解决不了以免对将来的安置工作造成影响.怎么样能让退役军人不流血流汗又流泪？,2020-03-18,2020-03-23
49,请问2019年的精神文明奖什么时候发放，烟台市一月份就发放了。,2020-03-21,2020-03-23
50,市长您好：即墨通济八里庄书记主任孙公华拥有多个小区的物业管理，在此次疫情中，只管自己的公司，村庄不用心防疫，大年初一感情用事带头在村中拜年（可以调村监控）。政府当官的便服调查中发现该村的疫情检查站可以随便出入，拿着群众性命当儿戏。2月13日-15日动员村民捐款，高调宣传用于村庄封闭时村民的日常生活，至今没有落实，并且拒绝村民张文庆想为村民买菜买肉等爱心行动。3月5号左右村低保户迟金德长时间在家没人管，成天喝凉水吃饼干，村民爬墙进家发现时已骨瘦如柴，接近昏迷，不能活动，送达医院时诊断为肿瘤，请政府帮帮低保这个群体.,2020-03-13,2020-03-23
51,我是2010年最后一批城镇户口带安置卡的退役士兵.我觉得青岛市退役军人事务局应该把国家的政策落到实处.201个退役士兵管理岗位有多少？安置率有新闻媒体宣传的那么高？安置工作公开性都存在纰漏.（在选工作时不公开工作内容）选岗时承诺的没有司机保安保洁服务员.都做到了吗？硬性安置的事情都解决不了以免对将来的安置工作造成影响.怎么样能让退役军人不流血流汗又流泪？,2020-03-18,2020-03-23
52,我们自主择业军转干部的退役金什么时候能按3号文件规定落实？,2020-03-20,2020-03-23
53,怀疑老人被骗，和他说不通 。我父亲60多岁了，在网络上听别人说买原始股能赚钱，买了9000多块钱的了，还让我从单位借5000块钱给他，我和他说可能是受骗了，他不听，还要和我断绝父子关系，让我滚出去租房住，心塞啊，请帮帮我！,2020-03-13,2020-03-22
54,习主席一再强调要保护绿水青山，可是海信积米湾项目还在开山毁林，这么好的山地规划山体公园多好啊。,2020-03-14,2020-03-20
55,请问第62例确诊病例的公婆等密切接触者均未发病？我们宁可要真相也不敢冒生命危险出门啊,2020-03-16,2020-03-20
56,我妈妈是糖尿病，江苏人，在青岛经常买药，这个能否优惠，或者享受医保政策呢？,2020-03-19,2020-03-20
57,请问在没有工作步入第三个月的导游员，文旅局有什么政策吗？我们该如何应对？哪怕一句问候也好啊，为什么不能替导游员找一些舒缓压力的办法？文旅局是为老百姓，更是为旅游从业者服务的！现在衣食父母出现问题了，能不能有点起码得关怀？让我们感受到文旅局的大家庭还没有把我们忘记？是不是应该给导游员一部分补助，让我们度过难关呢？就这样看着导游员们没办法养家糊口很好吗？,2020-03-18,2020-03-20
58,    很多市民在祭奠故人的时候习惯在路边烧纸，不仅影响环境，还有火灾隐患，建议禁止。马上要过清明节了，正好现在防疫有执勤的，建议可以一起宣传，一起监督。对于出售烧纸的单位，也应进行管控，从源头控制。,2020-03-20,2020-03-20
59,你好领导，现在的青岛即墨小李村布匹市场大家都知道太不上档次了，消防安全隐患大，里面乱搭乱建严重！跟即墨小商品城有一拼！建议政府重新选址高标准建设新的布匹市场和服装辅料市场！这样可以带动即墨服装产业向更好层次迈进！,2020-03-11,2020-03-20
60,请问:西海岸新区东区福利彩票管理站的地址在哪里？联系电话是什么号码？,2020-03-15,2020-03-19
序号,诉求,诉求时间,回复时间
61,       人民政府：        领导您好！我是青岛市市北区萍乡路一家个体工商户，我于2009年在市北区萍乡路11号—6租赁商铺一户，合法经营至今已有10余年。我们的国家是个社会大家庭，每个人都肩负着社会责任，为响应当前疫情防控工作，我商铺积极配合政府工作，关门歇业。      响应国家号召，抗击疫情，顾全大局，舍小家保大家，为了防控疫情蔓延毅然关掉营业中的店铺，这是一场前所未有的危机，新型冠状病毒感染肺炎疫情爆发，让2020年华夏大地瞬间变身为众志成城，抗击疫情的战场。我店铺春节期间备货损失较大，为了尽快回到正常的经营轨道，减少生活压力，望政府部门能出面与房东协商，为我店铺减免房租 ，让我们一起共渡难关，维护社会稳定团结。       我们坚信在疫情面前，只要我们社会各界坚定信心，携手共进，我们一定能打赢这场无硝烟的疫情防控阻击战！希望政府部门给于支持与协调！！,2020-03-13,2020-03-19
62,       人民政府：        领导您好！我是青岛市市北区萍乡路一家个体工商户，我于2009年在市北区萍乡路11号—6租赁商铺一户，合法经营至今已有10余年。我们的国家是个社会大家庭，每个人都肩负着社会责任，为响应当前疫情防控工作，我商铺积极配合政府工作，关门歇业。      响应国家号召，抗击疫情，顾全大局，舍小家保大家，为了防控疫情蔓延毅然关掉营业中的店铺，这是一场前所未有的危机，新型冠状病毒感染肺炎疫情爆发，让2020年华夏大地瞬间变身为众志成城，抗击疫情的战场。我店铺春节期间备货损失较大，为了尽快回到正常的经营轨道，减少生活压力，望政府部门能出面与房东协商，为我店铺减免房租 ，让我们一起共渡难关，维护社会稳定团结。       我们坚信在疫情面前，只要我们社会各界坚定信心，携手共进，我们一定能打赢这场无硝烟的疫情防控阻击战！希望政府部门给于支持与协调！！,2020-03-18,2020-03-19
63,请问是否可以考虑帮扶40--60这个年龄段失业人群的再就业？谢谢,2020-03-19,2020-03-19
64,请问在2019年第5批审核通过的，补贴发放了吗？,2020-03-18,2020-03-19
65,2020年3月16日19点左右，小区邻居进小区时被告知小区要封路，因为有加拿大留学归来人员要进入我们小区进行隔离，后了解得知该人员并非小区业主，而是市疾控中心安排给社区的入境隔离人员，社区没有安排在指定隔离场所和酒店，而是安排在了正居民楼里的日租房里，小区居民楼住满住户，尽是老弱妇孺。在疫情严控时期，所有居民小区都在防疫外来人员，市北敦化路街道社区却给花好月圆小区居民提供危险，实属不作为乱作为！！！,2020-03-17,2020-03-19
66,尊敬的市长您好:请问今年“清明节″市民可以到殡仪馆祭扫吗？谢谢！,2020-03-19,2020-03-19
67,各位领导，各位政务热线工作人员，实属无奈劳烦您们解答疑惑，在防疫工作这么吃劲的时候添麻烦了。我想咨询一个关于健康码的问题，因个人喜事，自己的家人朋友现居住在浙江，如果在浙江办理通过健康码审核，回青岛是否还要进行14天隔离，感谢,2020-03-18,2020-03-18
68,你好，我是2018年退役的士官，我建议你们能不能深入的去了解一下我们这次分配的工资，1800到5000，刚从部队回来一个月好几万的，一回来拿2000 3000。能不能有个给退役军人补贴什么的，你们可以研究一下，切身实际的帮我们这群人考虑考虑，谢谢,2020-03-18,2020-03-18
69,李沧区虎山路街道龙苑社区居委会成立时间不长，但是居民投诉太多，集中在主任赵瑞莲，工作人员李超，张光薇等人。因为龙苑社区居委会就在我们的小区里，小区居民对于龙苑社区居委会意见很大，特别是居委会主任赵瑞莲，是居民公认的“大泼妇”，朝居民吆吆喝喝的，在我们社区都有了赵瑞莲的顺口溜：                  一二三四五六七                  龙苑社区赵瑞莲                  就是一个大泼妇可见，赵瑞莲的素质多么低下了，上梁不正下梁歪，赵瑞莲素质差，也难怪其他工作人员李超，张光薇等人更是被居民投诉连连。总之，虎山路街道龙苑社区居委会，已经到了必须治理的情况了。,2020-03-11,2020-03-18
70,什么条件可申请法律援助,2020-03-15,2020-03-18
71,昨天确诊的市北区大港一例新冠病人、为什么在隔离期间去过这么多地方、市北区辖区的工作是怎么做的？为什么密切接触人员这么多？,2020-03-12,2020-03-18
72,各位领导您好由于平时以租赁街道平房，风吹日晒，靠摆摊来为孩子创造生活！由于街道堵塞俩个多月，让我没有经济来源负债累累，更无法继续支付房贷，房租，以及孩子的抚养能力！现在跪求西海岸黄岛区政府为孩子安排福利部门进行抚养，不要让祖国的花朵身心受到伤害！,2020-03-17,2020-03-18
73,李沧区都把社区封起来，投递报纸杂志很困难，能否让投递员临时进入，方便收发杂志报纸。,2020-03-05,2020-03-18
74,李沧区都把社区封起来，投递报纸杂志很困难，能否让投递员临时进入，方便收发杂志报纸。,2020-03-05,2020-03-18
75,我在即墨养蚂蚱目前这个野生动物禁食里面有没有蚂蚱，如果不让养了，有什么补助，,2020-03-07,2020-03-17
