序号,诉求,诉求时间,回复时间
1,青岛市民政局：上访人：周培兰，周培燕，周培基，周莉，周杰执笔人：周杰上访事由：青岛市济慈老年公寓疫情期间暴力虐待我母亲，残暴捆绑母亲双手，不给母亲喂饭喂水，直接导致母亲去世。事情经过：我已故母亲毛桂秋老人自2018年3月6日入住青岛市济慈老年公寓（地址：青岛市市北区清江路152号-29），自入住以来精神状态一切正常，思维清晰。每天一直都是由我们五个子女轮流进行陪护，老人自己可以进食吃饭并且胃口很好，我们子女去的目的主要就是陪老人聊聊天，给老人改善一下伙食，给老人带些喜欢吃的水果零食。老人虽然下半身不能动但是自己可以坐并且慢慢的挪动下床大小便，我们每天去也是不间断的给老人擦擦洗洗。老人爱干净，我们也经常打扫卫生，有时候甚至连床沿橱柜都一并打扫，省去了护工的绝大部分工作，护工需要做的只是早晚端过饭来给老人，晚上家属不在时给老人换一下尿布，我们这样做的目的一方面是出于对母亲的关怀和照顾，很大一方面也是希望帮护工分担一些工作，在家属不在跟前的时候护工可以善待老人，不让老人受委屈。在我们每天不间断的精心照顾下，母亲虽然已经90岁高龄，但是精神状态、胃口一直都很好。事情发生于疫情期间，养老院声称根据民政局的要求禁止家属进行探视。3月17日上午，青岛市济慈老年公寓陈原风院长、护工郝永燕、黄金花三人把三楼56床神志清晰、语言表述正常的老母亲强制、凶狠、暴力的按在床上，母亲一直在拼命挣扎抵抗，但是三人视若无睹，毫无人性的继续对我的90岁老母亲进行暴力捆绑！实行完这种惨无人道的暴行之后她们竟然哈哈大笑！在警方调取的监控中我们忍着悲愤的心情看见这段毫无人性的暴力行为，泣不成声。老人当时立即气的憋气、昏迷，陈原风院长做了缺德事害怕了就给我们打电话让家属立即到养老院，我哥哥接到电话急匆匆赶到后，一进门看到我母亲绑在床上非常气愤，立即给老母亲松绑，但是由于布绳绑的太紧未能解开，只能用剪子剪断布绳，试问一位90岁高龄的老人心理和身体上怎么能够承受这种羞辱和折磨！老人见到思念已久的儿子激动不已，高声呐喊“我没犯法为什么绑我！”我哥哥当即质问为什么捆绑母亲，吴红艳（当日值班班长）竟然回答说不知道，没有理由的对我老母亲进行放肆的羞辱和虐待，难道就是陈院长口中说的对老人的关怀和照顾？我哥哥忙着安抚老人的激动情绪，院方也一直催促让赶紧离开，情急慌乱之中我哥哥也没有想到去采取更多的措施，只是尽量安抚老人的情绪并强烈警告养老院捆绑老人的行为不准再有第二次，吴班长也当即保证不会再有下次。自那以后我母亲精神和身体上都受到了极大的伤害，更加希望家属进去探望，中间我们多次要求进去看看老人都被陈院长强烈拒绝。在这期间养老院因为护理不当导致我母亲从床上摔下来两次，直接不能动了！但是养老院却不通知我们家属，未对我们做任何的交代！如果不是从大夫和护工的口中得知真相，我们到现在还被蒙在鼓里！因为实在思念担心母亲的身体，迫不得已我们家人轮番拨打12345向政府求助，得到的答复都是与养老院联系，后面就没有下文了，有些电话甚至直接就没有得到回复！3月21日石大夫让家属送药才让我进去，我在给母亲擦洗身体时发现腿上胳膊上多处淤青！疫情发生前我们每天都陪护老人从来没出现过这种情况。我当即询问护工黄金花原因，她说老人太重搬不动用力过大造成的，试问有多大的力气才能让我母亲身上多处淤青，还是有其它的不为人知的暴力行为？我们不得而知。由于疫情期间，遵守国家规定，我进去一会儿石大夫就催我离开，我也只能和老人多说说话给她擦洗身上让她能舒服点。养老院疫情封闭期间， 我们家属每天和护工通话询问老母亲情况，得到的答复都是好好好，包括去养老院陈原风院长亲自和家属说她们照顾的很好，可是看了监控后才知道实情！我母亲太可怜了，老人已经不能坐只能躺着生拉硬拽，而且护工还不给老人擦拭洗漱，躺在床上的90岁母亲吃饭只能侧身用手颤微微的一点一点抓着饭吃！后几天母亲身体状况明显不好时，黄护工直接把饭放在板凳上！老人根本没力气，连用手抓饭的力气也没有了！护工一口也不喂，过来一趟看看饭一口都没动直接就端走了！如果说捆绑是约束，那对于一个失能的老人不喂饭，这绝对是虐待了吧！试问，这样的护工有资格继续从事老人的护理工作吗？试问，这就是陈原风院长对生活在线记者所说的关怀与心理疏导吗？试问，这样的养老机构值得我们老百姓信任和托付吗？3月24日我们心急如焚，打电话强烈要求进去看看老人但却遭到拒绝。当天下午石大夫打电话通知我们说老人情况不好（已下病危通知书）让家属尽快去，我们匆忙赶到养老院，在给我母亲换衣服擦洗身体时发现右肩有很大一块淤青，我们立即找来大夫、护士、护工询问原因，他们都说不知道，无法给我们一个合理的解释！当天我母亲的情况已经很不好了，陈原风院长还赶我们离开养老院，我们不放心坚决不走！              3月25日民政局给养老院打电话，说我们母亲的情况允许家属在那陪护，我们才得以进入养老院日夜照顾生命垂危的老母亲，当天晚上母亲自己用尽最后的力气把右肩的伤痕给我的姐姐们看，哭诉养老院对她进行的虐待和摧残！（当晚有视频录像做证据）我们看到后伤心至极，母亲去世后我们回想起来这段，冥冥中就是老人想让家人替她申冤吧！3月26日中午，老人就带着无处诉说的冤屈和一身伤撒手人寰了。目前我们已经报警，我们兄妹五人含着眼泪看了警方调取的监控视频，就连旁观的警察都气愤难当！可怜我那90岁的老母亲，是在一种怎样的折磨和虐待下度过的，每每想到此处我们兄妹都痛彻心扉！养老院院长陈原风和两位护工对老人的所作所为，简直是道德败坏，罄竹难书！如果不看录像，谁都不会知道陈原风是一个人面兽心的、对老人毫无爱心和同情心的人。上梁不正下梁歪，陈院长言传身教教给护工怎样虐待老人，沆瀣一气，以伤害老人取乐！试问这样的院长、这样的护工难道不应该得到社会的谴责和法律的制裁吗？如果这些恶人们得不到应有的惩罚，将会有更多像我母亲这样无助的老人落得可悲的遭遇和下场！我们全家一直遵纪守法，严格遵守国家在防疫期间的规定，我们信任养老院能够尽职尽责的照顾我年迈的老母亲，没想到他们回馈我们的却是我母亲满身的伤痕和非人的折磨！监控录像中母亲临走前的悲惨遭遇将永久成为我们兄妹心中难以抹去的阴影！我们希望并且也相信政府一定会还我们一个公道，我们全家都盼望尽快得到回复。上访诉求：济慈养老院陈原风院长、护工黄金花、郝永燕必须公开向我们家属道歉，向我母亲忏悔自己的过错，并负相关法律责任。2. 罢免陈原风的院长职务，终生不得从事养老服务和管理工作。3. 开除护工黄金花、郝永燕，终生取消此二人的养老服务护理资格。上访人员签名：陈闽琳身份证号：370203196301010335电话号码：13345017197住址：青岛市市北区芙蓉路110号1-604户,2020-04-04,2020-04-07
2,非常感谢退役军人局为我们退役士兵补交社保，大家都觉得有退役军人局退役士兵就有了保障，有了后盾。这次补交社保退役士兵都非常满意。再次谢谢退役军人局的领导和办事人员的辛苦，在此致以崇高的l军礼给退役士兵局的全体人员,2020-04-04,2020-04-07
3,习主席好！从你执政，首先是反腐败，治理环境，精准扶贫，尤其关心癌症病人不让国人因病治贫！我是2016年62岁得白血病，至今快四年了，每月退休金不够吃药的，根本在饥寒交迫中挣扎！度日如年！四年青岛市人民政府没给我提供一分钱帮助！国家规定白血病患者自费应该所在单位在报销70%我所在单位青岛市民政局至今一分不给报销我投诉到市长信箱根本无人查办！所以习主席说的不让一个国民因病治贫在青岛是句空话！青岛官员根本对你的指示置若罔闻！强烈恳请给65以上患白血病老人一条活路！现在在青岛健康退休人，和患白血病老人同样一个月190元能对吗？再说慢粒白血病患者只报销一种药，吃了毒性特别大头疼的要死，脸肿的变形，就要自己再寻医问药一个月就要3000_5000因此强烈恳请青岛市人民政府给老年白血病患者一条活路如下:一，65岁以上患白血病每年不住院患者一，社保卡每月补贴，2000元二，退休金每月补贴，2000元,2020-03-28,2020-04-07
4,     看到有居民投诉李沧区虎山路街道龙苑社区居委会的工作人员赵瑞莲和张光薇，我们深有体会，确实，龙苑社区成立后，工作人员根本没有能力，并且素质低下。所以，我们社区居民意见很大，建议有关部门严肃处理赵瑞莲，张光薇等人。,2020-03-27,2020-04-07
5,"请问我校2月24提交的陈亚鹏,刘祖源,薛佳倚三人的转学和转专业申请何时能审核,",2020-04-06,2020-04-07
6,取缔社区养鸽子，解决一下吧！！！为百姓办点事吧！！！,2020-04-06,2020-04-07
7,习主席好！从你执政，首先是反腐败，治理环境，精准扶贫，尤其关心癌症病人不让国人因病治贫！我是2016年62岁得白血病，至今快四年了，每月退休金不够吃药的，根本在饥寒交迫中挣扎！度日如年！四年青岛市人民政府没给我提供一分钱帮助！国家规定白血病患者自费应该所在单位在报销70%我所在单位青岛市民政局至今一分不给报销我投诉到市长信箱根本无人查办！所以习主席说的不让一个国民因病治贫在青岛是句空话！青岛官员根本对你的指示置若罔闻！强烈恳请给65以上患白血病老人一条活路！现在在青岛健康退休人，和患白血病老人同样一个月190元能对吗？再说慢粒白血病患者只报销一种药，吃了毒性特别大头疼的要死，脸肿的变形，就要自己再寻医问药一个月就要3000_5000因此强烈恳请青岛市人民政府给老年白血病患者一条活路如下:一，65岁以上患白血病每年不住院患者一，社保卡每月补贴，2000元二，退休金每月补贴，2000元,2020-03-28,2020-04-04
8,2020年新办的低保什么时间公布？,2020-03-28,2020-04-03
9,退役后参加了退役军人登记，但未收到光荣牌。2019年9月曾拨打市政热线反映过该问题，但一直没有相关部门给过明确答复。想知道，是否可以给我发放光荣牌？该牌对个人纪念意义重大，请有关部门给与答复。本人身份证37020319840106513X,2020-03-26,2020-04-03
10,我今年48周岁，是当教师的父亲带出来的非农业户口，应该是最后一批带家属的农转非的。这样就没了口粮地，由于政策的变化成为非农业户口的第二年开始也没有了供应粮。高中毕业后国家也没有给安置工作，家里也没有地，所以就一直在一些私企打工。结婚后自己做了一些小生意，这样我就想一个被遗忘在角落里的人，除了近两年有了一个大病统筹，我这个人跟这个国家似乎再没有半点关系。刚开始的时候感觉年轻力壮，自己做点小生意存点钱，老了也就没太大问题，可是天不遂人愿，投资失败欠了一屁股债，2017年又身患肺癌晚期，没有办法和能力挣钱治病养家，为了还债和治病原有的一套房产也卖了，现在寄居于亲戚家的闲置房。没有养老保险，没有大病救助，什么也没有，我成了一个当今社会裸奔的人。我就想问问领导，对于我们这些老教师家属，当年政策所致农转非的人， 特别像我这样的状况的人，有没有什么处理政策？谢谢！,2020-03-31,2020-04-02
11,坚决抗议青岛反动政府出卖民族利益，对帝国列强的卑躬屈膝！,2020-04-02,2020-04-02
12,尊敬的政府领导：我是湖岛街道滨海社区蓝泰海乐府2-2-101的居民，本人自己经营公司，公司所在地城阳区流亭街道苇山社区，因城阳区政府为了减轻小微企业疫情期间企业生存困难，对小微企业有部分补贴，其中对符合条件的员工及与报销百分之五十路费，及隔离期间补贴每天80元，我是购房后迁入青岛户口，籍贯江西丰城，年三十晚上回江西老家和年迈的父母一起过年，正月初三晚上返回青岛居家隔离，爱人籍贯辽宁本溪，正月初四返回青岛居家隔离，期间有社区工作人员给我打过电话，小区物业环卫保安都可以证明我在小区，今天下午三点左右去社区开居家隔离证明，社区态度坚决不给开证明，说我不符合开具证明条件，但流亭街道补助隔离期间费用必须要有证明，然后找物业，物业也不给开，政府为了减轻企业生存困境，作为小区所在的社区，物业为何连这样的证明也不开，怕担责任？从正月初三到现在已经过去两个多月，来回相互推诿，社区作为最基层的一级组织，防疫防控期间确实很幸苦，但对于今天下午这事，从接待态度到答复，我非常不满意，一进门大部分人在玩手机，我没有拍照，可以调取他们的监控查看，如果不相信，我每天随时可以去拍照他们的工作情况，其二说我以前去过社区说话态度不好，从滨海社区搬入海乐府小区，我一共进过社区两次，一次是建垃圾站的事，一次是去向他们要防疫防控宣传海报，我是一名退伍军人，2000年开公司至今，解决社会就业，上交税收，最起码为青岛建设做了不少贡献，而社区负责人向上级领导也就是湖岛街道领导请示也不开这样的证明，我就想不通，作为社区能为我们居民做什么？企业现在生存这么困难，一两千元对我我们来说都可以解决很多问题，为什么现在找政府办事这么难？不开具证明的依据又什么？社区解决不了，物业解决不了，只有求助政务网，帮忙协调解决，企业和个人能解决的事绝对不会给政府添麻烦，同时希望转正一下基层社区的办事作风，多为老百姓办点事实，少玩会手机，一个退伍老兵，一个有着近三十年党龄的老党员对政府的一点建议！让老百姓看到一个阳光为民办事的政府，而不是向今天一位社区工作人员还是负责人口口声声说的那样，我是公职人员，公职人员的工资是我们辛苦的纳税人所上交的，最后恳请政府帮忙协调一下谁能给我开具居家隔离证明？真诚的感谢?? 鄢明辉2020-3-27日夜,2020-03-28,2020-04-02
13,"黄岛区的名称实在太乱了，举例说下 黄岛区 黄岛 西海岸 开发区 老黄岛 胶南 等 一个行政区弄了5,6个名字。看看青岛其他行政区，人家都是一个名字，首先要改的就是这个名字太乱，很多人都认为黄岛是独立的市 而且不属于青岛的，要么你能独立成市也行，要么就把名字好好整理整理，统一成一个名字，政府相关部门是不是有责任？",2020-03-26,2020-04-02
14,我想问问领导们，为什么城镇户口的退伍兵就分配工作，农村户口的就不分配，这要是上战场，也是城镇户口的先上？这个政策很不合理吧,2020-03-23,2020-04-01
15,今年的精神文明奖复退军人有没有？,2020-03-31,2020-04-01
序号,诉求,诉求时间,回复时间
16,"市长您好,我是两个孩子的母亲,老大12岁了是脑瘫不会走路不会说话,老二两岁半,我老公开一个小理发店,因为疫情两个月没有收入了,以前给老大看病欠了很多钱,贷款,现在每个月都要还,没钱还,我想把房子做二押,我找贷款中介给的利息都高不说,他们还要收最少3个点10万块钱就是3000,3000都够我们一家好几个月的生活费了，我给城阳区政府留言说让我找市银保监局,可是政府部门没有这个,我就想你们能不能帮我们一家找个银行把我们房子做二押,让我们省点钱,我们实在是没有办法..感谢",2020-03-18,2020-04-01
17,西海岸新区胶南市泊里镇集体迁坟墓，政府在做决定的时候能否考虑下民意是怎样的？做一下充分调查，尊重下民意，我们是个人民当家做主的国家，在大多数人民的观念里还是有入土为安这一说的，这不是迷信，是中华传统文化的一部分，大多数村民还是希望不要迁坟，现在集体迁到那个地方，只是给他们小小的一个骨灰盒，摆在那里，大多数人心中都不好受，难道我们城市文明发展到连这些逝者的一方坟头都容不下？连他们这点地方我们都要占据？ 别忘记他们也是这个世界的一部分，一方小小的坟头既证明他们来过，也能给后人缅怀他们提供一个地方，能更好的教会这些后人生命的意义,2020-03-30,2020-04-01
18,疫情期间养老全面实行封院管理，禁止家属探视，我们都理解并支持。现在疫情已逐渐解除，各行各业也已复工，养老院还是不让家属探视是否太过于残忍，养老院最多一周给拍一张老人的照片或者视频，可以是根本就不是老人的真实状态，家属很不放心，为了顾全大局我们忍了，老人已经九十岁了，全失能，已经两个多月没见到亲人，你们能体会他们和我们的心情吗？百善孝为先是中华民族的传统美德，但不是建立在老人和家人的痛苦之上的，老人不是犯人，是弱势群体，我们家属有探视权，恳请民政部门能拿出一个切实可行的方案，真正的为民办事,2020-03-26,2020-04-01
19,被青岛淘云集app 骗了，希望可以得到帮助，那是我几熬出来的钱啊求求好心人帮助,2020-03-19,2020-04-01
20,胶东第十二中学搬迁的位置在哪？具体说明,2020-03-31,2020-03-31
21,我父亲王振邦生前是北海舰队军训处副处长，中共党员，山东陵县人，抗日战争参加八路军，战争年代多次负伤立功，1972年8月27日因病在青岛的海军401医院去逝，舰队和市政府根据我父亲生前为中国革命所做的突出贡献追为革命烈士。这次疫情网上追悼时发现有4处错误，让我们亲人遗憾！一是政治可面貌不祥，一位抗日战争参加革命的革命烈士还不是中共党员吗？二是藉贯不是山东凌而是山东陵县，三是去逝日期不是1972年8月2日而是1972年8月27日，四是安葬地不是九公陵而是青岛市烈士陵园，还有牺牲地是青岛海军401医院。最后希望你们工作认真点尽快更正。,2020-03-27,2020-03-31
22,习主席好！从你执政，首先是反腐败，治理环境，精准扶贫，尤其关心癌症病人不让国人因病治贫！我是2016年62岁得白血病，至今快四年了，每月退休金不够吃药的，根本在饥寒交迫中挣扎！度日如年！四年青岛市人民政府没给我提供一分钱帮助！国家规定白血病患者自费应该所在单位在报销70%我所在单位青岛市民政局至今一分不给报销我投诉到市长信箱根本无人查办！所以习主席说的不让一个国民因病治贫在青岛是句空话！青岛官员根本对你的指示置若罔闻！强烈恳请给65以上患白血病老人一条活路！现在在青岛健康退休人，和患白血病老人同样一个月190元能对吗？再说慢粒白血病患者只报销一种药，吃了毒性特别大头疼的要死，脸肿的变形，就要自己再寻医问药一个月就要3000_5000因此强烈恳请青岛市人民政府给老年白血病患者一条活路如下:一，65岁以上患白血病每年不住院患者一，社保卡每月补贴，2000元二，退休金每月补贴，2000元,2020-03-28,2020-03-30
23,"我父亲于2019年10月14日入院,经开颅手术,化疗,放疗,基因检测,免疫治疗,到2020年3月29日,5个多月时间,医疗费用报销后,自费花费11万3千余元,父亲离异独身,作为独生子我一直在医院,家里照顾,家里失去收入来源已经有半年时间,我父亲是否可以申请独生,子女医疗报销或者大病资金救助,贫困家庭,困难家庭申请,医疗费用可以2次报销,,怎么申请每个月的救助金,可以申请多少,我需要准备哪些材料,",2020-03-29,2020-03-30
24,习主席好！从你执政，首先是反腐败，治理环境，精准扶贫，尤其关心癌症病人不让国人因病治贫！我是2016年62岁得白血病，至今快四年了，每月退休金不够吃药的，根本在饥寒交迫中挣扎！度日如年！四年青岛市人民政府没给我提供一分钱帮助！国家规定白血病患者自费应该所在单位在报销70%我所在单位青岛市民政局至今一分不给报销我投诉到市长信箱根本无人查办！所以习主席说的不让一个国民因病治贫在青岛是句空话！青岛官员根本对你的指示置若罔闻！强烈恳请给65以上患白血病老人一条活路！现在在青岛健康退休人，和患白血病老人同样一个月190元能对吗？再说慢粒白血病患者只报销一种药，吃了毒性特别大头疼的要死，脸肿的变形，就要自己再寻医问药一个月就要3000_5000因此强烈恳请青岛市人民政府给老年白血病患者一条活路如下:一，65岁以上患白血病每年不住院患者一，社保卡每月补贴，2000元二，退休金每月补贴，2000元,2020-03-28,2020-03-30
25,你好，我想问一下我家老人是2019年一月二日去世的，到现在殡葬费还没有发下来是什么原因,2020-03-30,2020-03-30
26,铁山路的小区都粉刷了，灵山湾的小区也粉刷了，为什么就单单只有樱珠苑小区没有粉刷？要么都不粉刷，公平公正，单单落下樱珠苑小区为什么,2020-03-22,2020-03-30
27,我户籍在三亚，是青岛的公务员，请问能享受青岛居民的医保待遇吗？,2020-03-27,2020-03-30
28,"市南区针对市南区户籍人员在市南区创业孵化器2020年新注册公司的房租补贴有什么优惠政策,如何认定和办理,",2020-03-27,2020-03-27
29,铁山路的小区都粉刷了，灵山湾的小区也粉刷了，为什么就单单只有樱珠苑小区没有粉刷？要么都不粉刷，公平公正，单单落下樱珠苑小区为什么,2020-03-22,2020-03-27
30,山东省即墨区田横镇丰城北雄崖所220号韩超2016年-2019年2月违规吃低保，期间为儿子韩明敏买楼房，韩明敏在公路局上班，韩超借用其姐姐韩彩萍名义购买低速货车，车牌号鲁UZ0532，不符合救助条件，请民政局核查并追回之前违规领取的低保金,2020-03-20,2020-03-27
序号,诉求,诉求时间,回复时间
31,你好，如同标题看看有人管不？谢谢还要有礼节，要重复不断的求关注再次谢了，另外登州路街道办回复反馈别老是——信口雌黄了，干实事人们真心感激的。,2020-03-19,2020-03-27
32,立交桥下好多流浪人,2020-03-19,2020-03-27
33,3月12曰晚上19点45分，我家里母亲因为身体不好心脏病，我在网上给母亲订了送货到家的日用品，居委会借题发挥，以防疫零距离为借口阻挡送货人员把货送到母亲家中，非让我母亲自己搬上去，并且态度恶劣，辱骂群众，影响即坏，希望有关部门予人玫瑰督办，谢谢，此投诉市政府己挂单。,2020-03-17,2020-03-27
34,谢谢曹主任，谢谢各位网友，再见！,2020-03-26,2020-03-26
35,退役军人如何报考公务员？有没有优惠和加分政策？,2020-03-26,2020-03-26
36,我是湖北黄冈人，已在家隔离2个月，身体状况健康。但是咨询社区人员还需自费隔离14天。其他省份都已开始陆续互认湖北健康绿码，青岛政府为什么不考虑放宽政策，可以实施居家隔离呢,2020-03-25,2020-03-26
37,现在很多家庭都是独生子女，父母家里有钱，都是富二代，现在很多家庭有钱的父母给孩子安排稳定的工作，目的就是别让孩子惹事、但是现实生活中、还是有些富二代家庭的孩子在企业中惹事生非、不安分、到处挑拨离间、挑拨关系、不以赚钱为目的、拿着所谓成就感、获得感混日子，这种情况在社会中非常危险，孩子出事全是父母娇生惯养的，中国教育真的应该改变了，孩子18了就应该有自食其力，生活独立，资金独立了，这个应该学学国外18岁以后孩子应该独立生存，而不是还是依靠父母安逸、稳定的生活环境，现在的年轻人没有一点危机感！,2020-03-25,2020-03-25
